{
  "$schema": "https://json-schema.org/draft/2020-12/schema",
  "$id": "https://raw.githubusercontent.com/lifekit-hq/devclaw/main/docs/reference/devclaw-manifest.schema.json",
  "title": "devclaw project manifest (devclaw.json)",
  "description": "Human-owned, PR-reviewed per-project declaration read by devclaw through the project_manifest doorway. Devclaw never writes this file outside the reviewable onboard PR path.",
  "type": "object",
  "required": [
    "schemaVersion"
  ],
  "properties": {
    "$schema": {
      "type": "string",
      "description": "Optional pointer at this schema for editor validation."
    },
    "schemaVersion": {
      "type": "integer",
      "minimum": 1,
      "description": "Manifest schema version. A version newer than the running instance understands fails loudly ('instance too old'), never a partial parse."
    },
    "boilerplateRevision": {
      "type": "integer",
      "minimum": 0,
      "default": 0,
      "description": "The devclaw boilerplate revision this repo was last brought up to. Compared by doctor against the instance's BOILERPLATE_REVISION constant; re-onboard migrates."
    },
    "strictnessDefault": {
      "enum": [
        "trust",
        "strict"
      ],
      "description": "Per-project gate-strictness default. Precedence: explicit per-goal setting > this value > instance default ('trust'), resolved live at each goal-level read."
    },
    "surface": {
      "enum": [
        "app",
        "library"
      ],
      "description": "Declared frontend surface kind for the browser-E2E gate. 'library' applies the library exemption without path heuristics; 'app' or absent keeps the default glob heuristics. Read at pre_run_sha for gate decisions."
    },
    "verifyCmd": {
      "type": "string",
      "minLength": 1,
      "description": "Project-default verify command. Precedence: planner action verify_cmd > goal verify_cmd > this value. Resolved at dispatch (pre-run)."
    },
    "stack": {
      "type": "array",
      "items": {
        "type": "string"
      },
      "description": "Declared stack markers (e.g. 'dotnet', 'angular'). Informational in schema v1."
    },
    "capabilities": {
      "type": "array",
      "items": {
        "type": "string",
        "enum": [
          "registry:npm-github",
          "sandbox:image",
          "ci:definition"
        ]
      },
      "description": "Environment capabilities this project's verify contract depends on (spec 030). Ids are validated against the set this instance can probe \u2014 an unknown id fails the manifest loud rather than silently disabling the brake. A capability whose mechanical probe is red holds dispatch with a self-healing 'mechanical:env' block; nothing is inferred, and a project that declares none is admitted as before. Declaring 'registry:npm-github' makes an ABSENT NODE_AUTH_TOKEN red, not a supported posture."
    },
    "validation": {
      "type": "object",
      "required": [
        "boot",
        "suites"
      ],
      "properties": {
        "boot": {
          "type": "string",
          "minLength": 1,
          "description": "Command that boots a hermetic seeded instance (spec 015)."
        },
        "suites": {
          "type": "string",
          "minLength": 1,
          "description": "Command that runs the acceptance suites against it."
        },
        "smokePath": {
          "type": "string",
          "pattern": "^/",
          "default": "/",
          "description": "Path the read-only production smoke requests after a deploy."
        }
      },
      "description": "Live-validation contract (spec 015): validate_product boots the declared instance and runs the suites; the qa goal mode owns it."
    },
    "environment": {
      "type": "object",
      "properties": {
        "image": {
          "type": "string",
          "minLength": 1,
          "description": "The dev/SDK image the project's verify runs in (its .devcontainer base)."
        },
        "services": {
          "type": "array",
          "items": {
            "type": "string",
            "minLength": 1
          },
          "description": "Sibling services the verify needs (e.g. 'postgres:14')."
        },
        "tools": {
          "type": "array",
          "items": {
            "type": "string",
            "minLength": 1
          },
          "description": "Tools beyond the SDK the verify needs (e.g. 'dotnet-ef@10')."
        },
        "registries": {
          "type": "array",
          "items": {
            "type": "string",
            "minLength": 1
          },
          "description": "Package registries the install reads (e.g. 'npm-github')."
        },
        "verifyExcludes": {
          "type": "array",
          "items": {
            "type": "string",
            "minLength": 1
          },
          "description": "What verifyCmd does NOT run, in your own words (e.g. \"integration tests \u2014 they need Docker and Postgres, CI only\"). Rendered into the worker's dispatch brief so a PASS from a narrowed gate never reads as agreement with CI. Declared, never parsed: devclaw does not read your test runner's flags."
        }
      },
      "description": "The project's verification environment (spec 032 US4). Read since tinyspec verify-gate-is-never-narrower-than-ci: rendered into the worker's dispatch brief so a session does not rediscover that the sandbox is not the CI environment. Absent keeps today's behaviour."
    }
  },
  "additionalProperties": true
}
